{
  "nodes": [
    {
      "id": "p-customer",
      "type": "person",
      "label": "Retail Customer",
      "description": "Individual banking customer accessing via web and mobile",
      "technology": "",
      "x": 490.5550659735476,
      "y": -310.00966398666685,
      "width": 130,
      "height": 140,
      "collapsed": false
    },
    {
      "id": "p-corp",
      "type": "person",
      "label": "Corporate Client",
      "description": "Business customer using treasury and bulk-payment APIs",
      "technology": "",
      "x": -36.72383127545865,
      "y": -250.00966098666677,
      "width": 130,
      "height": 140,
      "collapsed": false
    },
    {
      "id": "p-ops",
      "type": "person",
      "label": "Bank Operator",
      "description": "Internal staff managing operations and support tickets",
      "technology": "",
      "x": 1113.5839165922573,
      "y": -70.00965998666682,
      "width": 130,
      "height": 140,
      "collapsed": false
    },
    {
      "id": "sys-core",
      "type": "system",
      "label": "Core Banking Platform",
      "description": "Central microservices platform handling all banking domain logic",
      "technology": "Kubernetes / Istio",
      "x": 412.3338909226659,
      "y": 589.9876909078889,
      "width": 1696.5508337205843,
      "height": 1539.835068174607,
      "collapsed": false
    },
    {
      "id": "sub-access",
      "type": "system",
      "label": "Access & Security",
      "description": "API gateway, authentication and authorisation for all inbound traffic",
      "technology": "Kong / Keycloak",
      "x": 90,
      "y": 90,
      "width": 620.5508297205843,
      "height": 556.0000010000003,
      "collapsed": false,
      "parentId": "sys-core"
    },
    {
      "id": "ctn-api-gw",
      "type": "container",
      "label": "API Gateway",
      "description": "Routes all external traffic, enforces rate limits and TLS termination",
      "technology": "Kong Gateway / Nginx",
      "x": 282.55153995328476,
      "y": 58.0026521054441,
      "width": 280,
      "height": 180,
      "collapsed": false,
      "parentId": "sub-access"
    },
    {
      "id": "ctn-auth",
      "type": "container",
      "label": "Auth Service",
      "description": "Identity & access management, issues JWT tokens via OIDC flow",
      "technology": "Keycloak / OAuth 2.0",
      "x": 58.00332448292613,
      "y": 318.0026531054443,
      "width": 280,
      "height": 180,
      "collapsed": false,
      "parentId": "sub-access"
    },
    {
      "id": "sub-banking",
      "type": "system",
      "label": "Banking Services",
      "description": "Core financial domain — accounts, payments and card management",
      "technology": "Java / Go microservices",
      "x": 850.5508327205844,
      "y": 90,
      "width": 756.0000009999999,
      "height": 556.0000010000003,
      "collapsed": false,
      "parentId": "sys-core"
    },
    {
      "id": "ctn-accounts",
      "type": "container",
      "label": "Accounts Service",
      "description": "Manages customer accounts, balances and statements",
      "technology": "Java 21 / Spring Boot",
      "x": 58.00071023270061,
      "y": 318.0026531054443,
      "width": 280,
      "height": 180,
      "collapsed": false,
      "parentId": "sub-banking"
    },
    {
      "id": "ctn-payments",
      "type": "container",
      "label": "Payments Service",
      "description": "Processes domestic and cross-border payment instructions",
      "technology": "Go 1.22 / gRPC",
      "x": 58.00071023270061,
      "y": 58.0026521054441,
      "width": 280,
      "height": 180,
      "collapsed": false,
      "parentId": "sub-banking"
    },
    {
      "id": "ctn-cards",
      "type": "container",
      "label": "Card Management",
      "description": "Issues and manages debit / credit cards, tokenisation",
      "technology": "Go 1.22 / REST",
      "x": 418.0007112327005,
      "y": 318.0026531054443,
      "width": 280,
      "height": 180,
      "collapsed": false,
      "parentId": "sub-banking"
    },
    {
      "id": "sub-risk",
      "type": "system",
      "label": "Risk & Compliance",
      "description": "Real-time fraud detection, regulatory reporting and AML controls",
      "technology": "Python / Scala",
      "x": 90,
      "y": 893.8350671746066,
      "width": 396,
      "height": 556.0000010000003,
      "collapsed": false,
      "parentId": "sys-core"
    },
    {
      "id": "ctn-fraud",
      "type": "container",
      "label": "Fraud Detection",
      "description": "Real-time ML-based transaction risk scoring and blocking",
      "technology": "Python 3.12 / XGBoost",
      "x": 58.00332448292613,
      "y": 318.00403626081743,
      "width": 280,
      "height": 180,
      "collapsed": false,
      "parentId": "sub-risk"
    },
    {
      "id": "ctn-reporting",
      "type": "container",
      "label": "Reporting Engine",
      "description": "Generates regulatory (PSD2, EBA) and management reports",
      "technology": "Scala 3 / Apache Spark",
      "x": 58.00332448292613,
      "y": 58.00403526081709,
      "width": 280,
      "height": 180,
      "collapsed": false,
      "parentId": "sub-risk"
    },
    {
      "id": "sub-platform",
      "type": "system",
      "label": "Platform Infrastructure",
      "description": "Async messaging, notifications and persistent data stores shared across all services",
      "technology": "Kafka / PostgreSQL / Redis",
      "x": 626.0000030000001,
      "y": 786.000004,
      "width": 980.5508307205841,
      "height": 466.0000009999999,
      "collapsed": false,
      "parentId": "sys-core"
    },
    {
      "id": "ctn-kafka",
      "type": "queue",
      "label": "Event Bus",
      "description": "Async domain-event streaming between all microservices",
      "technology": "Apache Kafka 3.6",
      "x": 359.5689702420848,
      "y": 318.00265310544387,
      "width": 240,
      "height": 90,
      "collapsed": false,
      "parentId": "sub-platform"
    },
    {
      "id": "ctn-notif",
      "type": "container",
      "label": "Notifications",
      "description": "Delivers push, SMS and e-mail alerts triggered by domain events",
      "technology": "Node.js 22 / FCM / Twilio",
      "x": 642.5515409532848,
      "y": 58.00265210544421,
      "width": 280,
      "height": 180,
      "collapsed": false,
      "parentId": "sub-platform"
    },
    {
      "id": "ctn-db-core",
      "type": "database",
      "label": "Accounts DB",
      "description": "Primary store for customer and account data",
      "technology": "PostgreSQL 15 / Patroni",
      "x": 58.003324482926246,
      "y": 288.00265310544387,
      "width": 200,
      "height": 120,
      "collapsed": false,
      "parentId": "sub-platform"
    },
    {
      "id": "ctn-db-tx",
      "type": "database",
      "label": "Transactions DB",
      "description": "Immutable append-only ledger of all financial transactions",
      "technology": "PostgreSQL 15 / Patroni",
      "x": 338.0033254829259,
      "y": 58.00265210544421,
      "width": 200,
      "height": 120,
      "collapsed": false,
      "parentId": "sub-platform"
    },
    {
      "id": "ctn-redis",
      "type": "database",
      "label": "Cache / Sessions",
      "description": "Session tokens, rate-limit counters and hot-path account data",
      "technology": "Redis 7 Cluster",
      "x": 58.003324482926246,
      "y": 58.00265210544421,
      "width": 200,
      "height": 120,
      "collapsed": false,
      "parentId": "sub-platform"
    },
    {
      "id": "sys-channels",
      "type": "system",
      "label": "Digital Channels",
      "description": "Customer-facing web portal and native mobile applications",
      "technology": "React / Swift / Kotlin",
      "x": 289.5347711750567,
      "y": -50.012314092111154,
      "width": 704.0507850429224,
      "height": 480.000001,
      "collapsed": false
    },
    {
      "id": "ctn-web",
      "type": "webapp",
      "label": "Web Banking",
      "description": "Full-featured banking portal and admin console for browsers",
      "technology": "React 18 / TypeScript",
      "x": 59.998812085744476,
      "y": 60.00265210544423,
      "width": 220,
      "height": 140,
      "collapsed": false,
      "parentId": "sys-channels"
    },
    {
      "id": "ctn-ios",
      "type": "webapp",
      "label": "iOS App",
      "description": "Native banking app for iPhone and iPad",
      "technology": "Swift 5.9 / SwiftUI",
      "x": 273.68699533399183,
      "y": 280.0026531054442,
      "width": 130,
      "height": 140,
      "collapsed": false,
      "parentId": "sys-channels"
    },
    {
      "id": "ctn-android",
      "type": "webapp",
      "label": "Android App",
      "description": "Native banking app for Android phones and tablets",
      "technology": "Kotlin / Jetpack Compose",
      "x": 514.0491434172003,
      "y": 280.0026531054442,
      "width": 130,
      "height": 140,
      "collapsed": false,
      "parentId": "sys-channels"
    },
    {
      "id": "sys-swift",
      "type": "system",
      "label": "SWIFT Network",
      "description": "International interbank messaging for cross-border wire transfers",
      "technology": "SWIFT MT / ISO 20022",
      "x": 1670.6253435763329,
      "y": 49.990339013333184,
      "width": 240,
      "height": 100,
      "collapsed": false,
      "external": true
    },
    {
      "id": "sys-visa",
      "type": "system",
      "label": "Card Networks",
      "description": "Visa and Mastercard payment authorisation and settlement",
      "technology": "ISO 8583 / Visa API",
      "x": 2462.481901266465,
      "y": 1077.7856830947255,
      "width": 240,
      "height": 100,
      "collapsed": false,
      "external": true
    },
    {
      "id": "sys-kyc",
      "type": "system",
      "label": "KYC / AML Provider",
      "description": "Identity verification and anti-money-laundering screening",